[
  {
    "advertiser": "Partner Postgres",
    "advertiser_domain": "partner-postgres.example",
    "headline": "Managed Postgres that scales to zero",
    "body": "Branching databases, a free tier that stays free, and no cold-start on the first query.",
    "cta": "See the free tier",
    "url_template": "https://partner-postgres.example/?ref={{program_id}}",
    "target_categories": ["software.devtools.database"],
    "target_regions": ["US", "CA", "GB", "EU"],
    "keywords": [
      "managed postgres",
      "postgres hosting",
      "database hosting",
      "hosted postgres",
      "serverless postgres"
    ],
    "ecpm": 14,
    "source": "affiliate",
    "network": "partnerstack",
    "active": true
  },
  {
    "advertiser": "Partner Data Platform",
    "advertiser_domain": "partner-data.example",
    "headline": "Postgres, Redis and object storage on one bill",
    "body": "One dashboard for the three stores most side projects end up needing.",
    "cta": "Compare plans",
    "url_template": "https://partner-data.example/?ref={{program_id}}",
    "target_categories": ["software.devtools.database"],
    "target_regions": ["US", "CA", "GB", "EU"],
    "keywords": ["managed database", "managed redis", "hosted database", "db hosting"],
    "ecpm": 11,
    "source": "affiliate",
    "network": "partnerstack",
    "active": true
  },
  {
    "advertiser": "Partner Deploy",
    "advertiser_domain": "partner-deploy.example",
    "headline": "Push to git, get a URL",
    "body": "Preview deploys per branch, custom domains on the free plan, no config file required.",
    "cta": "Deploy a project",
    "url_template": "https://partner-deploy.example/?ref={{program_id}}",
    "target_categories": ["software.devtools.hosting"],
    "target_regions": ["US", "CA", "GB", "EU"],
    "keywords": ["vercel", "netlify", "render hosting", "fly io", "railway app"],
    "ecpm": 12,
    "source": "affiliate",
    "network": "partnerstack",
    "active": true
  },
  {
    "advertiser": "Partner Cloud",
    "advertiser_domain": "partner-cloud.example",
    "headline": "Predictable servers, flat monthly pricing",
    "body": "Fixed-price instances with bandwidth included, so the bill does not surprise you.",
    "cta": "See pricing",
    "url_template": "https://partner-cloud.example/?ref={{program_id}}",
    "target_categories": ["software.devtools.hosting"],
    "target_regions": ["US", "CA", "GB", "EU"],
    "keywords": ["digitalocean", "linode", "vultr", "hetzner", "heroku"],
    "ecpm": 9,
    "source": "affiliate",
    "network": "impact",
    "active": true
  },
  {
    "advertiser": "Partner CI",
    "advertiser_domain": "partner-ci.example",
    "headline": "CI that finishes before you switch tabs",
    "body": "Parallel test splitting and cached dependencies, billed by the minute you actually use.",
    "cta": "Run your first build",
    "url_template": "https://partner-ci.example/?ref={{program_id}}",
    "target_categories": ["software.devtools.ci"],
    "target_regions": ["US", "CA", "GB", "EU"],
    "keywords": ["ci service", "ci provider", "ci cd platform", "github actions", "ci tool"],
    "ecpm": 13,
    "source": "affiliate",
    "network": "partnerstack",
    "active": true
  },
  {
    "advertiser": "Partner Pipelines",
    "advertiser_domain": "partner-pipelines.example",
    "headline": "Self-hosted runners without the maintenance",
    "body": "Bring your own hardware for the heavy jobs, keep the hosted control plane.",
    "cta": "Read the setup",
    "url_template": "https://partner-pipelines.example/?ref={{program_id}}",
    "target_categories": ["software.devtools.ci"],
    "target_regions": ["US", "CA", "GB", "EU"],
    "keywords": ["ci cd service", "continuous integration service", "ci platform", "ci tools"],
    "ecpm": 8,
    "source": "affiliate",
    "network": "impact",
    "active": true
  },
  {
    "advertiser": "Partner Signals",
    "advertiser_domain": "partner-signals.example",
    "headline": "Error tracking that groups by cause, not message",
    "body": "Source maps, release tagging, and a free tier that covers a small production app.",
    "cta": "Start tracking",
    "url_template": "https://partner-signals.example/?ref={{program_id}}",
    "target_categories": ["software.devtools.observability"],
    "target_regions": ["US", "CA", "GB", "EU"],
    "keywords": ["error monitoring", "error tracking", "sentry", "bugsnag", "rollbar"],
    "ecpm": 15,
    "source": "affiliate",
    "network": "partnerstack",
    "active": true
  },
  {
    "advertiser": "Partner Telemetry",
    "advertiser_domain": "partner-telemetry.example",
    "headline": "Dashboards from OpenTelemetry, no agent to install",
    "body": "Point your existing exporter at an endpoint and keep thirty days of traces.",
    "cta": "See a live dashboard",
    "url_template": "https://partner-telemetry.example/?ref={{program_id}}",
    "target_categories": ["software.devtools.observability"],
    "target_regions": ["US", "CA", "GB", "EU"],
    "keywords": ["grafana", "datadog", "new relic", "honeycomb", "error monitoring tool"],
    "ecpm": 12,
    "source": "affiliate",
    "network": "impact",
    "active": true
  },
  {
    "advertiser": "Partner Inference",
    "advertiser_domain": "partner-inference.example",
    "headline": "Open models behind one OpenAI-shaped endpoint",
    "body": "Swap models without changing code, and pay per token with no minimum.",
    "cta": "Read the quickstart",
    "url_template": "https://partner-inference.example/?ref={{program_id}}",
    "target_categories": ["software.devtools.ai"],
    "target_regions": ["US", "CA", "GB", "EU"],
    "keywords": ["llm api", "inference api", "openai compatible", "model hosting"],
    "ecpm": 16,
    "source": "affiliate",
    "network": "partnerstack",
    "active": true
  },
  {
    "advertiser": "Partner Vectors",
    "advertiser_domain": "partner-vectors.example",
    "headline": "Vector search that runs inside your Postgres",
    "body": "No second database to operate. Hybrid keyword and vector queries in one statement.",
    "cta": "See the extension",
    "url_template": "https://partner-vectors.example/?ref={{program_id}}",
    "target_categories": ["software.devtools.ai", "software.devtools.database"],
    "target_regions": ["US", "CA", "GB", "EU"],
    "keywords": ["vector database", "embeddings", "rag", "semantic search"],
    "ecpm": 13,
    "source": "affiliate",
    "network": "partnerstack",
    "active": true
  },
  {
    "advertiser": "Partner Secrets",
    "advertiser_domain": "partner-secrets.example",
    "headline": "Stop committing .env files",
    "body": "Encrypted secrets synced to local, CI and production from one place.",
    "cta": "Secure a project",
    "url_template": "https://partner-secrets.example/?ref={{program_id}}",
    "target_categories": ["software.security"],
    "target_regions": ["US", "CA", "GB", "EU"],
    "keywords": ["secrets manager", "env vars", "password manager", "api key storage"],
    "ecpm": 10,
    "source": "affiliate",
    "network": "impact",
    "active": true
  },
  {
    "advertiser": "Partner Focus",
    "advertiser_domain": "partner-focus.example",
    "headline": "Issue tracking that a two-person team will actually use",
    "body": "Keyboard-first, no required fields, and it closes issues from commit messages.",
    "cta": "Try it free",
    "url_template": "https://partner-focus.example/?ref={{program_id}}",
    "target_categories": ["software.productivity"],
    "target_regions": ["US", "CA", "GB", "EU"],
    "keywords": ["issue tracker", "project management", "task manager", "notion", "linear"],
    "ecpm": 7,
    "source": "affiliate",
    "network": "partnerstack",
    "active": true
  }
]
